{
  "site": "lima",
  "crs": "WGS84 (EPSG:4326)",
  "reaches": [
    {
      "node_id": "ottawa-head",
      "name": "Ottawa River upstream of Lima",
      "receiving_water": "Ottawa River",
      "downstream": "lima-abstraction",
      "length_km": 22.742,
      "coordinates": [
        [
          -83.9102486,
          40.787951596
        ],
        [
          -83.910609804,
          40.788202994
        ],
        [
          -83.911271602,
          40.788294196
        ],
        [
          -83.911933504,
          40.788339794
        ],
        [
          -83.912504904,
          40.788110897
        ],
        [
          -83.912805602,
          40.787882194
        ],
        [
          -83.912925802,
          40.787653394
        ],
        [
          -83.912775405,
          40.787561998
        ],
        [
          -83.912684903,
          40.787333496
        ],
        [
          -83.912865303,
          40.787150495
        ],
        [
          -83.913376607,
          40.786898799
        ],
        [
          -83.913827702,
          40.786601193
        ],
        [
          -83.914278805,
          40.786440998
        ],
        [
          -83.914549701,
          40.786578096
        ],
        [
          -83.915993802,
          40.7869206
        ],
        [
          -83.916234702,
          40.787126295
        ],
        [
          -83.916415401,
          40.787400596
        ],
        [
          -83.916686207,
          40.7875605
        ],
        [
          -83.9171376,
          40.787651896
        ],
        [
          -83.9181903,
          40.787468493
        ],
        [
          -83.919092804,
          40.787468195
        ],
        [
          -83.919453703,
          40.787262194
        ],
        [
          -83.919754207,
          40.786919095
        ],
        [
          -83.919934601,
          40.786736093
        ],
        [
          -83.920415901,
          40.786667399
        ],
        [
          -83.9220405,
          40.786986798
        ],
        [
          -83.922672406,
          40.787032299
        ],
        [
          -83.925379701,
          40.786962397
        ],
        [
          -83.926492907,
          40.787053294
        ],
        [
          -83.927184902,
          40.7870759
        ],
        [
          -83.927726202,
          40.786961295
        ],
        [
          -83.928117104,
          40.786686793
        ],
        [
          -83.9284776,
          40.786183596
        ],
        [
          -83.928477302,
          40.785817698
        ],
        [
          -83.9282666,
          40.785589099
        ],
        [
          -83.928266302,
          40.785223193
        ],
        [
          -83.928506501,
          40.784880199
        ],
        [
          -83.928566501,
          40.784582898
        ],
        [
          -83.928446107,
          40.784468696
        ],
        [
          -83.928475805,
          40.784056999
        ],
        [
          -83.928836703,
          40.783942595
        ],
        [
          -83.9293181,
          40.784125298
        ],
        [
          -83.929558806,
          40.784148
        ],
        [
          -83.930341102,
          40.784376197
        ],
        [
          -83.931033,
          40.784421697
        ],
        [
          -83.931243405,
          40.784192897
        ],
        [
          -83.9316044,
          40.784146897
        ],
        [
          -83.931935504,
          40.784306899
        ],
        [
          -83.932236306,
          40.784283794
        ],
        [
          -83.932386607,
          40.784192294
        ],
        [
          -83.932747103,
          40.783734798
        ],
        [
          -83.932957605,
          40.783551797
        ],
        [
          -83.933408007,
          40.782751299
        ],
        [
          -83.933407404,
          40.782110997
        ],
        [
          -83.932925701,
          40.781585395
        ],
        [
          -83.931481101,
          40.780831598
        ],
        [
          -83.930969402,
          40.780465998
        ],
        [
          -83.930367202,
          40.779643193
        ],
        [
          -83.930306606,
          40.779231697
        ],
        [
          -83.930516906,
          40.778979994
        ],
        [
          -83.930697307,
          40.778865598
        ],
        [
          -83.9324717,
          40.778453194
        ],
        [
          -83.932622001,
          40.778315894
        ],
        [
          -83.933313705,
          40.7782012
        ],
        [
          -83.933614306,
          40.778018095
        ],
        [
          -83.933674403,
          40.7778809
        ],
        [
          -83.933854803,
          40.777812198
        ],
        [
          -83.933974907,
          40.777606398
        ],
        [
          -83.934004307,
          40.776851699
        ],
        [
          -83.934515201,
          40.776462793
        ],
        [
          -83.934966207,
          40.776348196
        ],
        [
          -83.9354176,
          40.776462294
        ],
        [
          -83.935898803,
          40.776461996
        ],
        [
          -83.936710306,
          40.775935695
        ],
        [
          -83.936770506,
          40.775867097
        ],
        [
          -83.936980903,
          40.775752597
        ],
        [
          -83.937551707,
          40.775157899
        ],
        [
          -83.938002706,
          40.7748603
        ],
        [
          -83.938333005,
          40.774425693
        ],
        [
          -83.9385131,
          40.774014093
        ],
        [
          -83.938723207,
          40.773488
        ],
        [
          -83.9390238,
          40.773281999
        ],
        [
          -83.940647602,
          40.772983894
        ],
        [
          -83.941309005,
          40.772640496
        ],
        [
          -83.942571603,
          40.772159599
        ],
        [
          -83.943593301,
          40.771312997
        ],
        [
          -83.944555201,
          40.770855099
        ],
        [
          -83.945697702,
          40.770579994
        ],
        [
          -83.946870603,
          40.770373397
        ],
        [
          -83.949036404,
          40.770806395
        ],
        [
          -83.949578002,
          40.771080494
        ],
        [
          -83.950149506,
          40.771125793
        ],
        [
          -83.950569704,
          40.770325296
        ],
        [
          -83.950870506,
          40.770393699
        ],
        [
          -83.951201506,
          40.770530596
        ],
        [
          -83.951322101,
          40.770782098
        ],
        [
          -83.951442502,
          40.770896398
        ],
        [
          -83.952104107,
          40.770918794
        ],
        [
          -83.952254601,
          40.771010093
        ],
        [
          -83.953186907,
          40.771009497
        ],
        [
          -83.953968704,
          40.770894594
        ],
        [
          -83.955713205,
          40.770893298
        ],
        [
          -83.955833606,
          40.770961799
        ],
        [
          -83.956736006,
          40.771098398
        ],
        [
          -83.9575186,
          40.771577999
        ],
        [
          -83.958241202,
          40.772194795
        ],
        [
          -83.9586327,
          40.772674695
        ],
        [
          -83.958753601,
          40.7731319
        ],
        [
          -83.958964705,
          40.773520395
        ],
        [
          -83.959025405,
          40.774000496
        ],
        [
          -83.959115803,
          40.774137698
        ],
        [
          -83.959116504,
          40.774663597
        ],
        [
          -83.959237002,
          40.774823599
        ],
        [
          -83.959598303,
          40.775120497
        ],
        [
          -83.959748901,
          40.775348999
        ],
        [
          -83.959870204,
          40.776057698
        ],
        [
          -83.960231505,
          40.776400499
        ],
        [
          -83.960261904,
          40.776560396
        ],
        [
          -83.960352205,
          40.776606098
        ],
        [
          -83.960352607,
          40.776994899
        ],
        [
          -83.960202806,
          40.777360797
        ],
        [
          -83.959962301,
          40.777543798
        ],
        [
          -83.959782004,
          40.777612597
        ],
        [
          -83.9591804,
          40.777590193
        ],
        [
          -83.958307706,
          40.777247794
        ],
        [
          -83.957947001,
          40.777385294
        ],
        [
          -83.957826801,
          40.777476899
        ],
        [
          -83.957827203,
          40.777774096
        ],
        [
          -83.958308801,
          40.7780938
        ],
        [
          -83.958700202,
          40.778390795
        ],
        [
          -83.958790801,
          40.778665096
        ],
        [
          -83.958640702,
          40.778871
        ],
        [
          -83.958249904,
          40.779008493
        ],
        [
          -83.957227305,
          40.779054999
        ],
        [
          -83.956746407,
          40.779398397
        ],
        [
          -83.956506103,
          40.7797186
        ],
        [
          -83.956356205,
          40.780084595
        ],
        [
          -83.956417404,
          40.7809534
        ],
        [
          -83.956477903,
          40.781227693
        ],
        [
          -83.956839703,
          40.781844698
        ],
        [
          -83.9571108,
          40.782164596
        ],
        [
          -83.957141101,